{
  "candidates": {
    "bytes": 209308,
    "path": "<PROJECT_DIR>/examples/full-workflow-20260726/figure7-marker-v4/candidates.csv",
    "sha256": "82ad14c785acd0bc93ecab20347d3a6d0f504541e854739c49aba64ce967d7dd"
  },
  "chart_type": "line",
  "data": {
    "bytes": 381085,
    "path": "<PROJECT_DIR>/examples/full-workflow-20260726/figure7-marker-v4/data.csv",
    "sha256": "34093db00ab70746b29f9c9167aec03c8e7e93b65a23b922427d3a6acc25839f"
  },
  "formal_rows": 1255,
  "observation_rows": 1048,
  "observations": {
    "bytes": 239742,
    "path": "<PROJECT_DIR>/examples/full-workflow-20260726/figure7-marker-v4/observations.csv",
    "sha256": "82e3b615da6245f066e08f065d773c3287f759624a85e9f7951e0879d3b0be56"
  },
  "project_spec": {
    "bytes": 12806,
    "path": "<PROJECT_DIR>/examples/full-workflow-20260726/figure7-marker-v4/project.json",
    "sha256": "33929fbafe41ec9fedf8fdd4cd96b26960a51736bfe944653a9241ac85a27484"
  },
  "review_decisions": {
    "bytes": 117882,
    "path": "<PROJECT_DIR>/examples/full-workflow-20260726/figure7-marker-v4/review-decisions.json",
    "sha256": "de6458cb22d1b27cfbf8f7c36bb488d9b57e10715245a1ec775e2a8b43a882b4"
  },
  "schema": "more-sci-figure.formal-data-report.v1",
  "series": [
    {
      "curve_data_mode": "observations",
      "curve_topology": "continuous",
      "evidence_segment_count": 1,
      "formal_rows": 10,
      "formal_segment_count": 1,
      "id": "test-0deg",
      "normalized_visual_breaks": 0,
      "observation_rows": 10
    },
    {
      "curve_data_mode": "guide_constrained",
      "curve_topology": "continuous",
      "evidence_segment_count": 14,
      "formal_rows": 290,
      "formal_segment_count": 1,
      "id": "mfh-0deg",
      "normalized_visual_breaks": 13,
      "observation_rows": 164
    },
    {
      "curve_data_mode": "observations",
      "curve_topology": "continuous",
      "evidence_segment_count": 1,
      "formal_rows": 21,
      "formal_segment_count": 1,
      "id": "test-45deg",
      "normalized_visual_breaks": 0,
      "observation_rows": 21
    },
    {
      "curve_data_mode": "guide_constrained",
      "curve_topology": "continuous",
      "evidence_segment_count": 3,
      "formal_rows": 460,
      "formal_segment_count": 1,
      "id": "mfh-45deg",
      "normalized_visual_breaks": 2,
      "observation_rows": 449
    },
    {
      "curve_data_mode": "observations",
      "curve_topology": "continuous",
      "evidence_segment_count": 1,
      "formal_rows": 14,
      "formal_segment_count": 1,
      "id": "test-90deg",
      "normalized_visual_breaks": 0,
      "observation_rows": 14
    },
    {
      "curve_data_mode": "guide_constrained",
      "curve_topology": "continuous",
      "evidence_segment_count": 8,
      "formal_rows": 460,
      "formal_segment_count": 1,
      "id": "mfh-90deg",
      "normalized_visual_breaks": 7,
      "observation_rows": 390
    }
  ],
  "说明": "observations.csv 保存可见像素与证据断点；data.csv 保存经确认的曲线拓扑，视觉空档不再自动成为正式数据断点。"
}
